university_id,standard_university_names
1025,"Mahatma Gandhi Kashi Vidyapith (MGKVP)"
1026,"Mahatma Jyotiba Phule Rohilkhand University (MJPRU)"
1027,"Prof Rajendra Singh University (Rajju Bhaiya University Prayagraj)"
1028,"Ram Manohar Lohiya National Law University (RMLNLU)"
1029,"Sampurnanand Sanskrit University (SSVV)"
1030,"Sardar Vallabhbhai Patel University of Agriculture and Technology (SVBP Meerut)"
1031,"Siddharth University"
1032,"University of Lucknow (Lucknow University)"
1033,"UP Pt Deen Dayal Upadhyay Pashu Chikitsa Vigyan Vishwavidyalaya Evam Go-Ansundhan Sansthan (UPVETUNIV)"
1034,"Uttar Pradesh Rajarshi Tandon Open University (UPRTOU)"
1035,"Uttar Pradesh University of Medical Sciences (UPUMS)"
1036,"Veer Bahadur Singh Purvanchal University (VBSPU)"
1037,"Central University for Tibetan Studies (CUTS)"
1038,"Indian Veterinary Research Institute (IVRI)"
1039,"Sam Higginbottom Institute of Agriculture Technology and Sciences (SHUATS)"
1040,"Bhatkhande Music Institute"
1041,"Dayalbagh Educational Institute"
1042,"Jaypee University of Information Technology"
1043,"Santosh University"
1044,"Babu Banarasi Das University"
1045,"Bennett University"
1046,"Era University"
1047,"Galgotias University"
1048,"GLA University"
1049,"Glocal University"
1050,"IFTM University"
1051,"IIMT University"
1052,"Institute of Management Technology Ghaziabad (IMT Ghaziabad)"
1053,"Integral University Lucknow"
1054,"Invertis University"
1055,"Jagadguru Rambhadracharya Handicapped University"
1056,"JS University"
1057,"Maharishi University"
1058,"Mangalayatan University Aligarh"
1059,"Mohammad Ali Jauhar University"
1060,"Monad University"
1061,"Nehru Gram Bharti University"
1062,"Noida International University"
1063,"Raja Mahendra Pratap Singh State University (RMPSSU Aligarh)"
1064,"Rama University"
1065,"Sanskriti University"
1066,"Sharda University"
1067,"Shiv Nadar University"
1068,"Shobhit University"
1069,"Shri Venkateshwara University"
1070,"Swami Vivekanand Subharti University"
1071,"Teerthanker Mahaveer University"
1072,"Aryabhatta Research Institute of Observational Sciences (ARIES)"
1073,"Bharatendu Academy of Dramatic Arts"
1074,"Central Footwear Training Institute (CFTI Agra)"
1075,"Dr Ram Manohar Lohia Institute of Medical Sciences (DRRMLIMS)"
1076,"Indian Institute of Handloom Technology Varanasi (IIHT Varanasi)"
1077,"Indian Institute of Information Technology Allahabad (IIIT Allahabad)"
1078,"Indian Institute of Information Technology Lucknow (IIIT Lucknow)"
1079,"Indian Institute of Management Lucknow (IIM Lucknow)"
1080,"Indian Institute of Remote Sensing (IIRS)"
1081,"Indian Institute of Technology Kanpur (IIT Kanpur)"
1082,"Indian Institute of Technology Varanasi (IIT BHU)"
1083,"Indian Institute of Tourism and Travel Management Noida (IITTM Noida)"
1084,"Institute of Engineering and Rural Technology Prayagraj (IERT Prayagraj)"
1085,"Kendriya Hindi Sansthan (KHS)"
1086,"Motilal Nehru National Institute of Technology Allahabad (MNNIT Allahabad)"
1087,"MSME Technology Centre Kanpur"
1088,"National Institute of Pharmaceutical Education and Research Raebareli (NIPER Raebareli)"
1089,"National Sugar Institute Kanpur (NSI Kanpur)"
1090,"NTPC School of Business (NSB)"
1091,"Rajiv Gandhi Institute of Petroleum Technology (RGIPT)"
1092,"Sanjay Gandhi Postgraduate Institute of Medical Sciences (SGPGI Lucknow)"
1093,"Central Drug Research Institute (CDRI)"
1094,"Hemwati Nandan Bahuguna Garhwal University (HNBGU)"
1095,"Govind Ballabh Pant University of Agriculture and Technology (GBPUAT)"
1096,"Hemwati Nandan Bahuguna Uttarakhand Medical Education University (HNBUMU)"
1097,"Sri Dev Suman Uttarakhand University (SDSUV)"
1098,"Uttarakhand Aawasiya Vishwavidyalaya"
1099,"Uttarakhand Ayurveda University (UAU)"
1100,"Uttarakhand Open University (UOU)"
1101,"Uttarakhand Sanskrit University (USVV)"
1102,"Uttarakhand University of Horticulture and Forestry (UUHF)"
1103,"Forest Research Institute Dehradun (FRI Dehradun)"
1104,"Gurukul Kangri Vishwavidyalaya (GKV)"
1105,"Dev Sanskriti Vishwavidyalaya (DSVV)"
1106,"DIT University"
1107,"Graphic Era Hill University (GEHU)"
1108,"Graphic Era University"
1109,"Haridwar University"
1110,"Himalayan Garhwal University"
1111,"Himgiri Zee University (HZU)"
1112,"IMS Unison University"
1113,"Motherhood University"
1114,"Quantum University"
1115,"Shri Guru Ram Rai University"
1116,"Swami Rama Himalayan University (SRHU)"
1117,"University of Patanjali"
1118,"University of Petroleum and Energy Studies (UPES)"
1119,"Uttaranchal University"
1120,"All India Institute of Medical Sciences Rishikesh (AIIMS Rishikesh)"
1121,"Indian Institute of Management Kashipur (IIM Kashipur)"
1122,"Indian Institute of Technology Roorkee (IIT Roorkee)"
1123,"National Institute of Technology Uttarakhand (NIT Uttarakhand)"
1124,"Wildlife Institute of India (WII)"
1125,"Indian Institute of Engineering Science and Technology Shibpur (IIEST Shibpur)"
1126,"Visva Bharati University (VBU)"
1127,"Adamas University"
1128,"Aliah University"
1129,"Bankura University"
1130,"Bidhan Chandra Krishi Viswavidyalaya (BCKV)"
1131,"Calcutta University (CALUNIV)"
1132,"Cooch Behar Panchanan Barma University (CBPBU)"
1133,"Diamond Harbour Womens University"
1134,"Indian Institute of Science Education and Research Kolkata (IISER Kolkata)"
1135,"Jadavpur University"
1136,"Kazi Nazrul University (KNU)"
1137,"Maulana Abul Kalam Azad University of Technology (MAKAUT)"
1138,"Netaji Subhas Open University (NSOU)"
1139,"Presidency University"
1140,"Rabindra Bharati University (RBU)"
1141,"Raiganj University"
1142,"Senate of Serampore College (University)"
1143,"Sidho Kanho Birsha University (SKBU)"
1144,"The Sanskrit College and University"
1145,"University of Burdwan"
1146,"University of Engineering and Management"
1147,"University of Gour Banga (UGB)"
1148,"University of Kalyani"
1149,"University of North Bengal (NBU)"
1150,"Uttar Banga Krishi Vishwavidyalaya (UBKV)"
1151,"Vidyasagar University"
1152,"West Bengal National University of Juridical Sciences (WBNUJS)"
1153,"West Bengal State University (WBSU)"
1154,"West Bengal University of Animal and Fishery Sciences (WBUAFS)"
1155,"West Bengal University of Health Sciences (WBUHS)"
1156,"West Bengal University of Teachers Training Education Planning and Administration (WBUTTEPA)"
1157,"Indian Association for the Cultivation of Science (IACS)"
1158,"Brainware University"
1159,"JIS University"
1160,"Seacom Skills University"
1161,"St Xaviers University"
1162,"Techno India University"
1163,"The Neotia University"
1164,"Bose Institute"
1165,"Indian Institute of Chemical Biology (IICB)"
1166,"Indian Institute of Handloom Technology Fulia (IIHT Fulia)"
1167,"Indian Institute of Information Technology Kalyani (IIIT Kalyani)"
1168,"Indian Institute of Management Calcutta (IIM Calcutta)"
1169,"Indian Institute of Social Welfare and Business Management (IISWBM)"
1170,"Indian Institute of Technology Kharagpur (IIT Kharagpur)"
1171,"Indian Statistical Institute Kolkata (ISI Kolkata)"
1172,"International Management Institute Kolkata (IMI Kolkata)"
1173,"MSME Tool Room Kolkata"
1174,"National Institute of Biomedical Genomics (NIBMG)"
1175,"National Institute of Locomotor Disabilities (NILD)"
1176,"National Institute of Pharmaceutical Education and Research Kolkata (NIPER Kolkata)"
1177,"National Institute of Technical Teachers Training and Research Kolkata (NITTTR Kolkata)"
1178,"National Institute of Technology Durgapur (NIT Durgapur)"
1179,"SAIL Burnpur School of Nursing"
1180,"SN Bose National Centre for Basic Sciences (SNBNCBS)"
1181,"State Medical Faculty of West Bengal (SMFWB)"
1182,"University of Engineering Management Kolkata (UEM Kolkata)"
1183,"West Bengal Board of Primary Education (WBPPE)"
1184,"Central Sericultural Research and Training Institute (CSRTI)"
1185,"West Bengal Joint Entrance Examinations Board (WBJEEB)"
1186,"West Bengal State Council of Technical Education (WBSCTE)"
1187,"Soban Singh Jeena University (SSJU)"
1188,"Deccan Education Society,Pune (DES)"