university_id,standard_university_names
524,"Indian Institute of Management Kozhikode (IIM Kozhikode)"
525,"Indian Institute of Science Education and Research Thiruvananthapuram (IISER Thiruvananthapuram)"
526,"Indian Institute of Space Science and Technology (IIST)"
527,"Indian Institute of Technology Palakkad (IIT Palakkad)"
528,"Kerala State Institute of Design (KSID)"
529,"LBS Centre for Science and Technology (LBS Centre)"
530,"National Institute of Technology Calicut (NIT Calicut)"
531,"Sree Chitra Tirunal Institute for Medical Sciences and Technology (SCTIMST)"
532,"National Institute of Speech and Hearing (NISH)"
533,"Rajiv Gandhi Centre for Biotechnology (RGCB)"
534,"Commissioner of Entrance Examinations (CEE Kerala)"
535,"District Institute of Education and Training Lakshadweep (DIET Lakshadweep)"
536,"Kavaratti Institute of Paramedical Sciences"
537,"Dr Hari Singh Gour University (DHSGSU)"
538,"Indira Gandhi National Tribal University (IGNTU)"
539,"Atal Bihari Vajpayee Hindi Vishwavidyalaya (ABVHV)"
540,"Awadhesh Pratap Singh University (APSU)"
541,"Barkatullah University"
542,"Devi Ahilya University (DAUNIV)"
543,"Dr BR Ambedkar University of Social Sciences (BRAUSS)"
544,"Jawaharlal Nehru Krishi Vishwavidyalaya (JNKVV)"
545,"Jiwaji University"
546,"Madhya Pradesh Bhoj Open University (MPBOU)"
547,"Madhya Pradesh Medical Science University (MPMSU)"
548,"Maharaja Chhatrasal Bundelkhand University Chhatarpur (MCBU Chhatarpur)"
549,"Maharishi Mahesh Yogi Vedic University (MMYVU)"
550,"Maharishi Panini Sanskrit Evam Vedic Vishwavidyalaya (MPSVV Ujjain)"
551,"Maharishi Sandipani Rashtriya Ved Vidya Pratishthan (MSRVVP)"
552,"Mahatma Gandhi Chitrakoot Gramoday Vishwavidyalaya (MGCGV Chitrakoot)"
553,"Makhanlal Chaturvedi Rashtriya Patrakarita Avam Sanchar Vishwavidyalaya (MCU Bhopal)"
554,"Nanaji Deshmukh Veterinary Science University (NDVSU)"
555,"National Law Institute University (NLIU Bhopal)"
556,"North Eastern Indira Gandhi Regional Institute of Health and Medical Sciences (NEIGRIHMS)"
557,"Raja Mansingh Tomar Music and Arts University"
558,"Rajiv Gandhi Proudyogiki Vishwavidyalaya (RGPV)"
559,"Rajmata Vijayaraje Scindia Krishi Vishwa Vidyalaya (RVSKVV)"
560,"Rani Durgavati Vishwavidyalaya (RDV Jabalpur)"
561,"Sanchi University of Buddhist Indic Studies (Sanchi University)"
562,"Vikram University Ujjain"
563,"National Institute of Construction Management and Research (NICMAR)"
564,"MGM University of Health Sciences Mumbai (MGMUHS)"
565,"AISECT University"
566,"AKS University"
567,"G H Raisoni University"
568,"IES University"
569,"ITM University Gwalior"
570,"Jagran Lakecity University"
571,"Mandsaur University"
572,"Mangalayatan University Jabalpur"
573,"Oriental University"
574,"Peoples University Bhopal"
575,"PK University"
576,"Rabindranath Tagore University (RNTU Bhopal)"
577,"RKDF University"
578,"Sarvepalli Radhakrishnan University (SRKU)"
579,"Swami Vivekanand University (SVNU Sagar)"
580,"Techno Global University"
581,"All India Institute of Medical Sciences Bhopal (AIIMS Bhopal)"
582,"Atal Bihari Vajpayee Indian Institute of Information Technology and Management Gwalior (IIITM Gwalior)"
583,"Directorate of Technical Education Maharashtra (DTE Maharashtra)"
584,"Footwear Design and Development Institute (FDDI)"
585,"Indian Institute of Forest Management (IIFM Bhopal)"
586,"Indian Institute of Information Technology Bhopal (IIIT Bhopal)"
587,"Indian Institute of Information Technology Design and Manufacturing Jabalpur (IIITDM Jabalpur)"
588,"Indian Institute of Management Indore (IIM Indore)"
589,"Indian Institute of Science Education and Research Bhopal (IISER Bhopal)"
590,"Indian Institute of Technology Indore (IIT Indore)"
591,"Indian Institute of Tourism and Travel Management Bhubaneswar (IITTM Bhubaneswar)"
592,"Indian Institute of Tourism and Travel Management Gwalior (IITTM Gwalior)"
593,"Institute of Hotel Management Catering Technology and Applied Nutrition Mumbai (IHMCTAN Mumbai)"
594,"Institute of Hotel Management Gwalior (IHM Gwalior)"
595,"Jabalpur Engineering College (JEC)"
596,"Lakshmibai National University of Physical Education (LNIPE)"
597,"Maulana Azad National Institute of Technology (MANIT Bhopal)"
598,"MSME Technology Centre Bhopal"
599,"National Institute of Technical Teachers Training and Research Bhopal (NITTTR Bhopal)"
600,"Regional Institute of Education Bhopal (RIE Bhopal)"
601,"School of Planning and Architecture Bhopal (SPA Bhopal)"
602,"Madhya Pradesh Employees Selection Board (MPESB)"
603,"Mahatma Gandhi Antarrashtriya Hindi Vishwavidyalaya (MGAHV)"
604,"Dr Babasaheb Ambedkar Marathwada University (BAMU)"
605,"Dr Babasaheb Ambedkar Technological University (DBATU)"
606,"Dr Balasaheb Sawant Konkan Krishi Vidyapeeth (DBSKKV)"
607,"Dr Homi Bhabha State University"
608,"Dr Panjabrao Deshmukh Krishi Vidyapeeth Akola (PDKV)"
609,"Gondwana University"
610,"HSNC University"
611,"Kavayitri Bahinabai Chaudhari North Maharashtra University (NMU)"
612,"Kavikulaguru Kalidas Sanskrit University (KKSU)"
613,"Maharashtra Animal and Fishery Sciences University (MAFSU)"
614,"Maharashtra National Law University Aurangabad (MNLU Aurangabad)"
615,"Maharashtra National Law University Mumbai (MNLU Mumbai)"
616,"Maharashtra National Law University Nagpur (MNLU Nagpur)"
617,"Maharashtra University of Health Sciences (MUHS)"
618,"Mahatma Phule Krishi Vidyapeeth (MPKV)"
619,"Rashtrasant Tukadoji Maharaj Nagpur University (RTMNU)"
620,"Sant Gadge Baba Amravati University (SGBAU)"
621,"Savitribai Phule Pune University (SBPPU)"
622,"Shivaji University"
623,"Shreemati Nathibai Damodar Thackersey Women University (SNDT University)"
624,"Solapur University"
625,"Swami Ramanand Teerth Marathwada University (SRTMUN)"
626,"University of Mumbai (Mumbai University)"
627,"Vasantrao Naik Marathwada Krishi Vidyapeeth (VNMKV)"
628,"Yashwantrao Chavan Maharashtra Open University (YCMOU)"
629,"Defence Institute of Advanced Technology (DIAT Pune)"
630,"Homi Bhabha National Institute (HBNI)"
631,"Indira Gandhi Institute of Development Research (IGIDR)"
632,"Institute of Chemical Technology Mumbai (ICT Mumbai)"
633,"International Institute for Population Sciences (IIPS)"
634,"Tata Institute of Fundamental Research (TIFR)"
635,"Tata Institute of Social Sciences (TISS)"
636,"Tilak Maharashtra University (TMU)"
637,"Chinmaya Vishwavidyapeeth"
638,"Datta Meghe Institute of Medical Sciences (DMIMSU)"
639,"Deccan College Post-Graduate and Research Institute"
640,"DY Patil University"
641,"Gokhale Institute of Politics and Economics (GIPE)"
642,"Krishna Institute of Medical Sciences (KIMS)"
643,"MGM University of Health Sciences"
644,"Pravara Institute of Medical Sciences"
645,"Symbiosis International University"
646,"Ajeenkya D Y Patil University (ADYPU)"
647,"Akhil Bharatiya Gandharva Mahavidyalaya Mandal (ABGMVM)"
648,"Apex University"
649,"Chhatrapati Shivaji Maharaj University (CSMU)"
650,"FLAME University"
651,"Indian Institute of Science Education and Research Pune (IISER Pune)"
652,"MIT - ADT University"
653,"Sandip University"
654,"SP Jain Institute of Management and Research (SPJIMR)"
655,"Tolani Maritime Institute (TMI Pune)"
656,"Whistling Woods International"
657,"Academy of Scientific and Innovative Research (AcSIR)"
658,"Ali Yavar Jung National Institute of Speech and Hearing Disabilities (AYJNIHH Mumbai)"
659,"All India Institute of Physical Medicine and Rehabilitation (AIIPMR)"
660,"Bhabha Atomic Research Centre (BARC)"
661,"Homi Bhabha Centre for Science Education (HBCSE)"
662,"Indian Institute of Banking and Finance (IIBF)"
663,"Indian Institute of Information Technology Nagpur (IIIT Nagpur)"
664,"Indian Institute of Information Technology Pune (IIIT Pune)"
665,"Indian Institute of Management Mumbai (IIM Mumbai)"
666,"Indian Institute of Management Nagpur (IIM Nagpur)"
667,"Indian Institute of Technology Bombay (IIT Bombay)"
668,"Indo German Tool Room (IGTR Aurangabad)"
669,"National Academy of Defence Production (NADP Nagpur)"
670,"National Fire Service College (NFSC Nagpur)"
671,"National Institute For Research in Reproductive Health (NIRRH)"
672,"National Institute of Abiotic Stress Management (NIASM)"
673,"National Institute of Bank Management (NIBM Pune)"
674,"National Institute of Securities Markets (NISM)"
675,"National Insurance Academy (NIA Pune)"
676,"Tata Memorial Centre Hospital (TMC Hospital)"
677,"Vaikunth Mehta National Institute of Cooperative Management (VAMNICOM)"
678,"Visvesvaraya National Institute of Technology (VNIT Nagpur)"
679,"Central Institute of Fisheries Education (CIFE)"
680,"Indian Institute of Geomagnetism (IIGM)"
681,"Inter University Centre for Astronomy and Astrophysics (IUCAA)"
682,"Central Agricultural University (CAU)"
683,"Manipur University"
684,"National Sports University Manipur (NSU Manipur)"
685,"Manipur Technical University"
686,"Manipur University Of Culture (MUC)"
687,"Sangai International University (SIU Manipur)"
688,"Indian Institute of Information Technology Manipur (IIIT Manipur)"
689,"National Institute of Technology Manipur (NIT Manipur)"
690,"English and Foreign Languages University (EFL)"
691,"North Eastern Hill University (NEHU)"
692,"CMJ University"
693,"Mahatma Gandhi University Meghalaya (MGU Meghalaya)"
694,"Martin Luther Christian University (MLCU)"
695,"University of Science and Technology (USTM)"
696,"University of Technology and Management (UTM)"
697,"William Carey University (WCU Shillong)"
698,"Indian Institute of Management Shillong (IIM Shillong)"
699,"National Institute of Technology Meghalaya (NIT Meghalaya)"
700,"National Law University Meghalaya (NLU Meghalaya)"
701,"North East Regional Institute of Education (NERIE)"
702,"Directorate of Educational Research and Training Meghalaya (DERT Meghalaya)"
703,"Mizoram University (MZU)"
704,"National Institute of Technology Mizoram (NIT Mizoram)"
705,"Nagaland University"
706,"Global Open University"
707,"St Joseph University Nagaland"
708,"National Institute of Technology Nagaland (NIT Nagaland)"
709,"Indira Gandhi National Open University (IGNOU)"
710,"Central University of Orissa (CU Orissa)"
711,"All India Institute of Medical Sciences Bhubaneswar (AIIMS Bhubaneswar)"
712,"Berhampur University"
713,"Biju Patnaik University of Technology (BPUT)"
714,"Fakir Mohan University (FMU)"
715,"Gangadhar Meher University (GMU Sambalpur)"
716,"Khallikote University"
717,"Maharaja Sriram Chandra Bhanjadeo University (MSCBU)"
718,"National Law University Odisha (NLUO)"
719,"Odisha State Open University (OSOU)"
720,"Orissa University of Agriculture and Technology (OUAT)"
721,"Rama Devi Women University"
722,"Ravenshaw University"
723,"Sambalpur University"
724,"Shri Jagannath Sanskrit Vishvavidyalaya (SJSV)"
725,"Utkal University"
726,"Utkal University of Culture (UUC)"
727,"Veer Surendra Sai University of Technology (VSSUT)"
728,"Kalinga Institute of Industrial Technology (KIIT)"
729,"Kalinga Institute of Social Sciences (KISS)"
730,"Siksha O Anusandhan"
731,"ASBM University"
732,"Birla Global University (BGU)"
733,"Centurion University"
734,"International Management Institute Bhubaneswar (IMI Bhubaneswar)"
735,"Sri Sri University"
736,"Xavier University Bhubaneswar"
737,"Central Tool Room and Training Centre (CTTC Bhubaneswar)"
738,"Indian Institute of Handloom Technology Bargarh (IIHT Bargarh)"
739,"Indian Institute of Management Sambalpur (IIM Sambalpur)"
740,"Indian Institute of Science Education and Research Berhampur (IISER Berhampur)"
741,"Indian Institute of Technology Bhubaneswar (IIT Bhubaneswar)"
742,"Institute of Hotel Management Bhubaneswar (IHM Bhubaneswar)"
743,"Institute of Life Sciences Bhubaneswar (ILS Bhubaneswar)"
744,"Institute of Mathematics and Applications Bhubaneswar (IOMA Bhubaneswar)"
745,"International Institute of Information Technology Bhubaneswar (IIIT Bhubaneswar)"
746,"National Institute of Science Education and Research (NISER)"
747,"National Institute of Technology Rourkela (NIT Rourkela)"
748,"Regional Institute of Education Bhubaneswar (RIE Bhubaneswar)"
749,"Swami Vivekanand National Institute of Rehabilitation Training and Research (SVNIRTAR Cuttack)"
750,"Institute of Physics Bhubaneswar (IOPB)"
751,"Regional Medical Research Centre Bhubaneswar (RMRC Bhubaneswar)"
752,"State Selection Board Odisha (SSB Odisha)"
753,"Pondicherry University"
754,"Sri Balaji Vidyapeeth (SBV)"
755,"Pondicherry Institute of Medical Sciences (PIMS)"
756,"Indira Gandhi Medical College and Research Institute (IGMCRI)"
757,"Jawaharlal Institute of Postgraduate Medical Education and Research (JIPMER)"
758,"National Institute of Technology Puducherry (NIT Puducherry)"
759,"Central University of Punjab (CUP)"
760,"Baba Farid University of Health Sciences (BFUHS)"
761,"Guru Angad Dev Veterinary and Animal Sciences University (GADVASU)"
762,"Guru Nanak Dev University (GNDU)"
763,"Guru Ravidas Ayurved University (GRAU Punjab)"
764,"I K Gujral Punjab Technical University (IKGPTU)"
765,"Jagat Guru Nanak Dev Punjab State Open University (PSOU)"
766,"Maharaja Ranjit Singh Punjab Technical University (MRSPTU)"
767,"Panjab University"
768,"Punjab Agricultural University (PAU)"
769,"Punjabi University"
770,"Rajiv Gandhi National University of Law (RGNUL)"
771,"Sardar Beant Singh State University (SBSSU Gurdaspur)"
772,"Sant Longowal Institute of Engineering and Technology (SLIET Longowal)"
773,"Thapar Institute of Engineering and Technology"
774,"Adesh University"
775,"Akal University"
776,"CT University"
777,"Desh Bhagat University"
778,"GNA University"
779,"Guru Kashi University"
780,"Lovely Professional University (LPU)"
781,"Rayat Bahra University"
782,"Sant Baba Bhag Singh University"
783,"Sri Guru Granth Sahib World University"
784,"Army College of Nursing Jalandhar (ACN Jalandhar)"
785,"Army Institute of Law (AIL Mohali)"
786,"Dr B R Ambedkar National Institute of Technology Jalandhar (NIT Jalandhar)"
787,"Indian Institute of Management Amritsar (IIM Amritsar)"
788,"Indian Institute of Science Education and Research Mohali (IISER Mohali)"
789,"Indian Institute of Technology Ropar (IIT Ropar)"
790,"Institute of Hotel Management Gurdaspur (IHM Gurdaspur)"
791,"Institute of Nano Science and Technology Mohali (INST Mohali)"
792,"National Agri Food Biotechnology Institute (NABI)"
793,"National Institute of Pharmaceutical Education and Research (NIPER Mohali)"
794,"Netaji Subhas National Institute of Sports (NIS Patiala)"
795,"Post Graduate Institute of Medical Education and Research Chandigarh (PGIMER Chandigarh)"
796,"Central University of Rajasthan (CURAJ)"
797,"Agriculture University Jodhpur"
798,"Agriculture University Kota"
799,"All India Institute of Medical Sciences Jodhpur (AIIMS Jodhpur)"
800,"Dr Sarvepalli Radhakrishnan Rajasthan Ayurved University Jodhpur (RAU Jodhpur)"
801,"Govind Guru Tribal University (GGTU)"
802,"Haridev Joshi University of Journalism and Mass Communication (HJUJ)"
803,"Jagadguru Ramanandacharya Rajasthan Sanskrit University"
804,"Jai Narain Vyas University (JNVU)"
805,"Maharaja Ganga Singh University (MGSU)"
806,"Maharaja Surajmal Brij University (MSBU)"
807,"Maharana Pratap University of Agriculture and Technology (MPUAT)"
808,"Maharshi Dayanand Saraswati University (MDSU)"
809,"Mohanlal Sukhadia University (MLSU)"
810,"National Law University Jodhpur (NLU Jodhpur)"
811,"Pandit Deendayal Upadhyaya Shekhawati University (PDUSU)"
812,"Raj Rishi Bhartrihari Matsya University (RRBMU)"
813,"Rajasthan Sports University"
814,"Rajasthan Technical University (RTU)"
815,"Rajasthan University of Health Sciences (RUHS)"
816,"Rajasthan University of Veterinary and Animal Sciences (RAJUVAS)"
817,"Sardar Patel University of Police Security and Criminal Justice"
818,"Sri Karan Narendra Agriculture University (SKNAU)"
819,"Swami Keshwanand Rajasthan Agricultural University (SKRAU)"
820,"University of Kota (UOK)"
821,"University of Rajasthan (UNIRAJ)"
822,"Vardhaman Mahaveer Open University (VMOU)"
823,"Banasthali Vidyapith"
824,"Birla Institute of Technology and Science Pilani (BITS Pilani)"
825,"IIS University Jaipur"
826,"Institute of Advanced Studies in Education"
827,"Jain Vishva Bharati University (JVBI)"
828,"Janardan Rai Nagar Rajasthan Vidyapeeth University"
829,"LNM Institute of Information Technology (LNMIIT)"
830,"Bhagwant University"
831,"Career Point University Kota"
832,"Dr KNModi University"
833,"Geetanjali University"
834,"Jagannath University Jaipur"
835,"Jaipur National University"
836,"Jayoti Vidyapeeth Womens University"
837,"JECRC University"
838,"JK Lakshmipat University"
839,"Jodhpur National University"
840,"Madhav University"
841,"Maharishi Arvind University"
842,"Mewar University"
843,"Mody University"
844,"NIIT University"
845,"NIMS University"
846,"Nirwan University"
847,"OPJS University"
848,"Pacific University Udaipur"
849,"Poornima University"
850,"RNB Global University"
851,"Sangam University"
852,"Shri Jagdishprasad Jhabrmal Tibrewala University"
853,"Shridhar University"
854,"Singhania University"
855,"Sir Padampat Singhania University (SPSU)"
856,"Suresh Gyan Vihar University (SGVU)"
857,"Vivekananda Global University"
858,"Indian Institute of Crafts and Design (IICD Jaipur)"
859,"Indian Institute of Handloom Technology Jodhpur (IIHT Jodhpur)"
860,"Indian Institute of Information Technology Kota (IIIT Kota)"
861,"Indian Institute of Management Udaipur (IIM Udaipur)"
862,"Indian Institute of Technology Jodhpur (IIT Jodhpur)"
863,"Malaviya National Institute of Technology Jaipur (MNIT Jaipur)"
864,"National Institute of Ayurveda Jaipur (NIA Jaipur)"
865,"Regional Institute of Education Ajmer (RIE Ajmer)"
866,"Central Electronics Engineering Research Institute (CEERI)"
867,"Sikkim University"
868,"Eastern Institute for Integrated Learning in Management University"
869,"Sikkim Manipal University"
870,"Sikkim Professional University"
871,"National Institute of Technology Sikkim (NIT Sikkim)"
872,"National Law University Sikkim (NLU Sikkim)"
873,"Central University of Tamil Nadu (CUTN)"
874,"National Institute for Empowerment of Persons with Multiple Disablities (NIEPMD)"
875,"Alagappa University"
876,"Anna University (AU Chennai)"
877,"Annamalai University"
878,"Bharathiar University"
879,"Bharathidasan University (BDU Tiruchirappalli)"
880,"Madurai Kamaraj University (MKU)"
881,"Manonmaniam Sundaranar University"
882,"Mother Teresa Womens University (MTWU)"
883,"Periyar University"
884,"Tamil Nadu Agricultural University (TNAU)"
885,"Tamil Nadu Dr Ambedkar Law University (TNDALU)"
886,"Tamil Nadu Dr J Jayalalithaa Fisheries University (TNJFU)"
887,"Tamil Nadu Dr MGR Medical University (TNMGRMU)"
888,"Tamil Nadu Horticulture University (TNHU)"
889,"Tamil Nadu Music and Fine Arts University (TNMAFU)"
890,"Tamil Nadu Open University (TNOU)"
891,"Tamil Nadu Physical Education and Sports University (TNPESU)"
892,"Tamil Nadu Teachers Education University (TNTEU)"
893,"Tamil Nadu Veterinary and Animal Sciences University (TANUVAS)"
894,"Tamil University"
895,"Thiruvalluvar University"
896,"University of Madras (UNOM)"
897,"Avinashilingam University"
898,"Chennai Mathematical Institute (CMI)"
899,"Gandhigram Rural Institute (GRI)"
900,"AMET University"
901,"Bharath University"
902,"Chettinad Academy of Research and Education (CARE)"
903,"Dr MGR Educational and Research Institute"
904,"Hindustan Institute of Technology and Science (HITS)"
905,"Karpagam Academy of Higher Education (KAHE)"
906,"Karunya University"
907,"Noorul Islam University"
908,"Periyar Maniammai University"
909,"Ponnaiyah Ramajayam Institute of Science and Technology (PRIST University)"
910,"SASTRA University"
911,"Sathyabama University"
912,"Sri Chandrasekharendra Saraswathi Viswa Mahavidyalaya"
913,"Sri Ramachandra Medical College and Research Institute"
914,"St Peter Institute of Higher Education and Research (SPIHER)"
915,"Vel Tech Rangarajan Dr Sagunthala RD Institute of Science and Technology (Vel Tech University)"
916,"Vellore Institute of Technology (VIT University)"
917,"Vels University"
918,"Vinayaka Missions Research Foundation (VMRF)"
919,"Amrita Vishwa Vidyapeetham"
920,"Bharat University"
921,"BS Abdur Rahman Crescent - Institute of Science"
922,"Divine Hands International University (DHIU)"
923,"Kalasalingam University"
924,"Meenakshi Academy of Higher Education and Research"
925,"MGR Educational and Research Institute"
926,"Saveetha University"
927,"Woxsen University"
928,"Central Electrochemical Research Institute (CECRI)"
929,"Central Institute of Petrochemicals Engineering and Technology (CIPET)"
930,"Centre for Economic and Social Studies (CESS)"
931,"Christian Medical College and Hospital Vellore (CMCH Vellore)"
932,"Indian Institute of Handloom Technology Salem (IIHT Salem)"
933,"Indian Institute of Information Technology Design and Manufacturing Kancheepuram (IIITDM Kancheepuram)"
934,"Indian Institute of Information Technology Tiruchirappalli (IIIT Tiruchirappalli)"
935,"Indian Institute of Management Tiruchirappalli (IIM Tiruchirappalli)"
936,"Indian Institute of Technology Madras (IIT Madras)"
937,"Indian Statistical Institute Chennai (ISI Chennai)"
938,"Institute of Mathematical Sciences (IMSC)"
939,"Madras Institute of Development Studies (MIDS)"
940,"Madras School of Economics (MSE)"
941,"National Institute of Technical Teachers Training and Research Chennai (NITTTR Chennai)"
942,"National Institute of Technology Tiruchirappalli (NIT Trichy)"
943,"National Instructional Media Institute (NIMI)"
944,"Rajiv Gandhi National Institute of Youth Development (RGNIYD)"
945,"Regional Institute of Education Mysore (RIE Mysore)"
946,"Sardar Vallabhbhai Patel International School Of Textiles and Management (SVPISTM)"
947,"Tamil Nadu National Law School (TNNLS)"
948,"Tamil Virtual Academy"
949,"Central Institute of Brackishwater Aquaculture (CIBA)"
950,"Central Leather Research Institute (CLRI)"
951,"Indian Institute of Food Processing Technology (IIFPT)"
952,"National Board of Examination in Rehabilitation (NBER)"
953,"Tripura Board of Joint Entrance Examination (TBJEE)"
954,"Maulana Azad National Urdu University (MANUU)"
955,"University of Hyderabad (UOHYD)"
956,"Dr B R Ambedkar Open University (BRAOU)"
957,"Jamia Nizamia"
958,"Kakatiya University"
959,"Kaloji Narayana Rao University of Health Sciences (KNRUHS)"
960,"Mahatma Gandhi University Nalgonda (MGU Nalgonda)"
961,"National Academy of Legal Study and Research University of Law Hyderabad (NALSAR)"
962,"Osmania University"
963,"Palamuru University"
964,"Potti Sreeramulu Telugu University"
965,"Professor Jayashankar Telangana State Agricultural University (PJTSAU)"
966,"PV Narasimha Rao Telangana Veterinary University (PVNRTVU)"
967,"Satavahana University"
968,"Sri Konda Laxman Telangana State Horticultural University (SKLTSHU)"
969,"Telangana University"
970,"Indian Institute of Technology Hyderabad (IIT Hyderabad)"
971,"Indian Statistical Institute Hyderabad (ISI Hyderabad)"
972,"International Institute of Information Technology Hyderabad (IIIT Hyderabad)"
973,"Jawaharlal Nehru Architecture and Fine Arts University (JNAFAU)"
974,"National Academy of Construction (NAC)"
975,"National Institute for the Empowerment of Persons with Intellectual Disabilities (NIEPID)"
976,"National Institute of Animal Biotechnology (NIAB)"
977,"National Institute of Pharmaceutical Education and Research Hyderabad (NIPER Hyderabad)"
978,"National Institute of Technology Warangal (NIT Warangal)"
979,"Nizam Institute of Medical Sciences (NIMS)"
980,"Telangana Social Welfare Residential Educational Institutions Society (TSWREIS)"
981,"Centre for Cellular and Molecular Biology (CCMB)"
982,"Centre for DNA Fingerprinting and Diagnostics (CDFD)"
983,"Indian Institute of Chemical Technology (IICT)"
984,"Indian Institute of Millets Research (IIMR)"
985,"National Academy of Agricultural Research Management (NAARM)"
986,"National Geophysical Research Institute (NGRI)"
987,"National Institute of Agricultural Extension Management (MANAGE)"
988,"National Institute of Nutrition (NIN Hyderabad)"
989,"National Institute of Plant Health Management (NIPHM)"
990,"National Institute of Rural Development and Panchayati Raj Hyderabad (NIRD)"
991,"Telangana State Council of Higher Education (TSCHE)"
992,"Telangana Tribal Welfare Residential Educational Institutions Society (TTWREIS)"
993,"Tripura University"
994,"Agartala Government Medical College"
995,"Maharaja Bir Bikram University (MBBU)"
996,"National Institute of Technology Agartala (NIT Agartala)"
997,"National Law University Tripura (NLU Tripura)"
998,"Aligarh Muslim University (AMU)"
999,"Babasaheb Bhimrao Ambedkar University (BBAU)"
1000,"Banaras Hindu University (BHU)"
1001,"Indira Gandhi Rashtriya Uran Akademi (IGRUA)"
1002,"Rajiv Gandhi National Aviation University (RGNAU)"
1003,"Rani Lakshmi Bai Central Agricultural University (RLBCAU)"
1004,"University of Allahabad"
1005,"Acharya Narendra Dev University of Agriculture and Technology (NDUAT)"
1006,"Atal Bihari Vajpayee Medical University (ABVMU)"
1007,"Banda University of Agriculture and Technology (BUAT)"
1008,"Bundelkhand University"
1009,"Chandra Shekhar Azad University of Agriculture and Technology (CSAUK)"
1010,"Chaudhary Charan Singh University (CCS University)"
1011,"Chhatrapati Shahu Ji Maharaj University Kanpur (CSJMU Kanpur)"
1012,"Deen Dayal Upadhyay Gorakhpur University (DDUGU)"
1013,"Dr APJ Abdul Kalam Technical University (AKTU)"
1014,"Dr Bhim Rao Ambedkar University (DBRAU)"
1015,"Dr Ram Manohar Lohia Avadh University (RMLAU)"
1016,"Dr Shakuntala Misra National Rehabilitation University (DSMRU)"
1017,"Gautam Buddha University (GBU)"
1018,"Harcourt Butler Technical University (HBTU)"
1019,"Jananayak Chandrashekhar University (JNCU)"
1020,"Khwaja Moinuddin Chishti Urdu Arabi Farsi University"
1021,"King Georges Medical University (KGMU)"
1022,"Maa Shakumbhari University (MSU Saharanpur)"
1023,"Madan Mohan Malaviya University of Technology (MMMUT)"
1024,"Maharaja Suhel Dev State University Azamgarh (MSDSU)"
